speaker,minute,text
Lin,0,"Dr. Vance, I'm still reeling from my debate with Aris. The engineering teams are charging ahead with the Digital Twin models as if the human body is just another server rack. I was reviewing the proposed data pipelines , and the sheer volume of continuous biometric telemetry is staggering. We are talking about mapping a patient's entire genetic and epigenetic future. It feels like an ethical nightmare waiting to happen."
Vance,2,"I completely understand your frustration, Lin, and your concerns are entirely valid. Aris and the engineering teams are driven by the life-saving potential of the technology, but they often treat privacy as an afterthought. You are absolutely right that our current regulatory frameworks are unequipped to handle predictive biometric modeling. However, trying to put the genie back in the bottle won't work either. We need to focus on implementing structural safeguards, like establishing independent Medical Data Trusts. In this model, a patient's digital replica is managed by a fiduciary whose sole legal obligation is to the patient, not a tech corporation."
Lin,5,"A Medical Data Trust sounds great in a white paper, Vance, but let's look at reality. The infrastructure required to process neuroergonomic data and run continuous AI simulations is massively expensive. The corporations funding this will demand a return on investment, which means monetizing those biomarkers. I'm terrified of a scenario where insurance companies buy access to epigenetic risk scores to quietly deny coverage based on a disease a person might develop twenty years from now."
Vance,8,"That form of epigenetic discrimination is exactly what we need to preemptively outlaw. But from a technical standpoint, we don't have to choose between medical innovation and absolute privacy. We can utilize zero-knowledge proofs and homomorphic encryption. This allows the AI to run complex health simulations on the Digital Twin without ever actually decrypting or exposing the underlying raw data. The system gets the predictive result—like an impending cardiac event—without ever 'seeing' the patient's identity or genetic code."
Lin,11,"Encryption only protects the data once it's in the cloud. What about the collection methods? Aris is pushing for phase two trials of smart dust . We are talking about microscopic, ingestible sensors that broadcast internal health metrics 24/7. What happens if those sensors are intercepted locally? Or worse, what happens when employers start mandating ingestibles under the guise of 'corporate wellness programs' to track employee fatigue and focus?"
Vance,14,"Employer mandates would be a gross violation of bodily autonomy, and I would testify against that in any hearing. As for the hardware itself, the next generation of smart dust is designed to be fully biodegradable. It doesn't permanently reside in the body; it dissolves after a set monitoring period, which limits the window of vulnerability. But you are highlighting the core issue: the socioeconomic divide. The wealthy will use these tools for extreme longevity, while marginalized workers could face biometric surveillance."
Lin,17,"Exactly. Until we have an ironclad, international treaty that guarantees absolute biometric sovereignty—declaring that a person's Digital Twin and all its predictive data is an extension of their physical body and subject to the exact same human rights—deploying this technology at scale is societal malpractice. We cannot let tech companies 'move fast and break things' when the 'thing' being broken is fundamental human privacy."
Vance,20,"I can't argue with that, Lin. The ethical foundation must be poured before we build the house. Perhaps our next step isn't trying to slow down the engineers, but accelerating the policymakers. We need to draft that framework for biometric sovereignty and get it in front of the international regulatory committees immediately."